Title,Score,Comments,URL
"r/Stocks Daily Discussion & Fundamentals Friday Nov 15, 2024",21,424,https://www.reddit.com/r/stocks/comments/1grtfyq/rstocks_daily_discussion_fundamentals_friday_nov/
"r/Stocks Daily Discussion Wednesday - Nov 20, 2024",7,273,https://www.reddit.com/r/stocks/comments/1gvmifm/rstocks_daily_discussion_wednesday_nov_20_2024/
"Nvidia Earnings: Beat Across the Board, Strong Guidance",363,193,https://www.reddit.com/r/stocks/comments/1gvzyeh/nvidia_earnings_beat_across_the_board_strong/
"Target shares plunge 20% after discounter cuts forecast, posts biggest earnings miss in two years",536,291,https://www.reddit.com/r/stocks/comments/1gvrcw8/target_shares_plunge_20_after_discounter_cuts/
Snowflake Q3 Earnings,43,11,https://www.reddit.com/r/stocks/comments/1gvzu5w/snowflake_q3_earnings/
ECB warning on equity and sovereign debt risk,33,6,https://www.reddit.com/r/stocks/comments/1gvls9p/ecb_warning_on_equity_and_sovereign_debt_risk/
Adani Group shares nosedive after chairman Gautam Adani charged with fraud in New York,1,0,https://www.reddit.com/r/stocks/comments/1gw7gn4/adani_group_shares_nosedive_after_chairman_gautam/
"Comcast will announce the spinoff of cable networks Wednesday, CNBC source says",172,58,https://www.reddit.com/r/stocks/comments/1gvbwzv/comcast_will_announce_the_spinoff_of_cable/
Insider trading,31,77,https://www.reddit.com/r/stocks/comments/1gvku4g/insider_trading/
"Qualcomm says it expects $4 billion in PC chip sales by 2029, as company gets traction beyond smartphones",166,27,https://www.reddit.com/r/stocks/comments/1gv9g66/qualcomm_says_it_expects_4_billion_in_pc_chip/
"Exciting times for space, nuclear and quantum computing stocks!",251,119,https://www.reddit.com/r/stocks/comments/1gv0dex/exciting_times_for_space_nuclear_and_quantum/
Understanding tax implications for international stocks,2,3,https://www.reddit.com/r/stocks/comments/1gvt6p6/understanding_tax_implications_for_international/
"Palantir short thesis and an analysis of its current earnings power, multiples and enterprise value",59,43,https://www.reddit.com/r/stocks/comments/1gv6hj0/palantir_short_thesis_and_an_analysis_of_its/
"Sony is in talks to buy Kadokawa, media powerhouse behind 'Elden Ring'",88,22,https://www.reddit.com/r/stocks/comments/1gv1vyw/sony_is_in_talks_to_buy_kadokawa_media_powerhouse/
Walmart raises guidance after another strong earnings report ahead of the holiday season,155,41,https://www.reddit.com/r/stocks/comments/1guvqmr/walmart_raises_guidance_after_another_strong/
C3.ai (AI) Company Analysis,40,37,https://www.reddit.com/r/stocks/comments/1gv3vio/c3ai_ai_company_analysis/
Okta - my analysis and thoughts,11,12,https://www.reddit.com/r/stocks/comments/1gvcfnz/okta_my_analysis_and_thoughts/
" UBER, Bright Future or Dim outlook?",33,60,https://www.reddit.com/r/stocks/comments/1gv32bn/uber_bright_future_or_dim_outlook/
Trying to understand the mechanics/risk of SGOV vs short term treasuries Money Market vs a HYSA and their relative safety.,9,6,https://www.reddit.com/r/stocks/comments/1gvawfq/trying_to_understand_the_mechanicsrisk_of_sgov_vs/
ETSY turned things around and finally solved their issues. Better than Pinterest. ,18,20,https://www.reddit.com/r/stocks/comments/1gv5vi4/etsy_turned_things_around_and_finally_solved/
DoJ wants to Breakup Google,769,266,https://www.reddit.com/r/stocks/comments/1gui0ub/doj_wants_to_breakup_google/
"Big selling by insiders, CEO’s and big players",217,151,https://www.reddit.com/r/stocks/comments/1guq5rh/big_selling_by_insiders_ceos_and_big_players/
"Are VOO, SPY, SPX500 considered as ETF's or CFD's?",0,6,https://www.reddit.com/r/stocks/comments/1gvpw7m/are_voo_spy_spx500_considered_as_etfs_or_cfds/
Super Micro hires new auditor to maintain Nasdaq listing; shares pop 23%,245,91,https://www.reddit.com/r/stocks/comments/1gukbfk/super_micro_hires_new_auditor_to_maintain_nasdaq/
What your take on FMNA/FMCC?,14,9,https://www.reddit.com/r/stocks/comments/1guxfrh/what_your_take_on_fmnafmcc/
Trading SPY for gains,0,17,https://www.reddit.com/r/stocks/comments/1gvicis/trading_spy_for_gains/
Hold off on investing until February?,0,41,https://www.reddit.com/r/stocks/comments/1gvoo6f/hold_off_on_investing_until_february/
"r/Stocks Daily Discussion & Technicals Tuesday - Nov 19, 2024",9,288,https://www.reddit.com/r/stocks/comments/1guu616/rstocks_daily_discussion_technicals_tuesday_nov/
S&P 500 Rebalancing Trade,150,48,https://www.reddit.com/r/stocks/comments/1gu7pfu/sp_500_rebalancing_trade/
QUESTION: Warren Buffet annualized returns without Apple?,89,49,https://www.reddit.com/r/stocks/comments/1gu76al/question_warren_buffet_annualized_returns_without/
Trump Team Is Seeking to Ease US Rules for Self-Driving Cars,274,67,https://www.reddit.com/r/stocks/comments/1gtwjvx/trump_team_is_seeking_to_ease_us_rules_for/
MCD and SOUN?,21,3,https://www.reddit.com/r/stocks/comments/1gu6rqi/mcd_and_soun/
My research and direction of McD,4,11,https://www.reddit.com/r/stocks/comments/1guj6s9/my_research_and_direction_of_mcd/
"Brendan Carr - ""vocal critic of Big Tech"" - to Lead FCC",213,88,https://www.reddit.com/r/stocks/comments/1gttj8j/brendan_carr_vocal_critic_of_big_tech_to_lead_fcc/
Best way to get exposure to Mexico as an overall economy?,4,25,https://www.reddit.com/r/stocks/comments/1gui43v/best_way_to_get_exposure_to_mexico_as_an_overall/
Self driving is coming to your favourite cars,0,2,https://www.reddit.com/r/stocks/comments/1gv3gxn/self_driving_is_coming_to_your_favourite_cars/
BioNTech Analysis and Questions ,13,18,https://www.reddit.com/r/stocks/comments/1gu7m4p/biontech_analysis_and_questions/
Tax Loss Harvesting,8,21,https://www.reddit.com/r/stocks/comments/1gu75r0/tax_loss_harvesting/
"New Nvidia AI chips overheating in servers, the Information reports",307,139,https://www.reddit.com/r/stocks/comments/1gtlzww/new_nvidia_ai_chips_overheating_in_servers_the/
"AMCOR (AMCR) AND BERRY (BERY) TO COMBINE IN AN ALL-STOCK TRANSACTION, CREATING A GLOBAL LEADER IN CONSUMER & HEALTHCARE PACKAGING SOLUTIONS",0,4,https://www.reddit.com/r/stocks/comments/1guvy9k/amcor_amcr_and_berry_bery_to_combine_in_an/
"r/Stocks Daily Discussion Monday - Nov 18, 2024",17,208,https://www.reddit.com/r/stocks/comments/1gu1svl/rstocks_daily_discussion_monday_nov_18_2024/
Is this right or am I thinking about this wrong,0,36,https://www.reddit.com/r/stocks/comments/1guyq4n/is_this_right_or_am_i_thinking_about_this_wrong/
My research and direction of ABNB,74,29,https://www.reddit.com/r/stocks/comments/1gtrdjh/my_research_and_direction_of_abnb/
EQIX and DLR - are they benefitting at all from AI datacenter buildouts?,3,7,https://www.reddit.com/r/stocks/comments/1gu8ztm/eqix_and_dlr_are_they_benefitting_at_all_from_ai/
Is PLTR in bubble territory?,275,344,https://www.reddit.com/r/stocks/comments/1gtdoq4/is_pltr_in_bubble_territory/
Creating Stop Loss on Webull? ,1,18,https://www.reddit.com/r/stocks/comments/1gu8j2v/creating_stop_loss_on_webull/
Most Efficient Way to Track Public Trades?,21,13,https://www.reddit.com/r/stocks/comments/1gtojeb/most_efficient_way_to_track_public_trades/
Portfolio Strategies Post Election,0,49,https://www.reddit.com/r/stocks/comments/1gua5qj/portfolio_strategies_post_election/
Chris Wright - CEO of Liberty Energy and board member of Oklo Inc. tapped to be US Energy Secretary,296,75,https://www.reddit.com/r/stocks/comments/1gt2e8y/chris_wright_ceo_of_liberty_energy_and_board/
Do you see Meta copying Reddit one day ?,0,45,https://www.reddit.com/r/stocks/comments/1guc5qv/do_you_see_meta_copying_reddit_one_day/
What's the point in investing on a stock like Coca Cola?,447,387,https://www.reddit.com/r/stocks/comments/1gsx74y/whats_the_point_in_investing_on_a_stock_like_coca/
Lets talk pharma stocks,130,110,https://www.reddit.com/r/stocks/comments/1gsqisf/lets_talk_pharma_stocks/
HSA investment ratios and advice,11,20,https://www.reddit.com/r/stocks/comments/1gsv5im/hsa_investment_ratios_and_advice/
"r/Stocks Weekly Thread on Meme Stocks Saturday - Nov 16, 2024",10,4,https://www.reddit.com/r/stocks/comments/1gsrmji/rstocks_weekly_thread_on_meme_stocks_saturday_nov/
BKNG and negative shareholder equity.,23,8,https://www.reddit.com/r/stocks/comments/1gskiba/bkng_and_negative_shareholder_equity/
Does everyone suffer from the same FOMO?,133,160,https://www.reddit.com/r/stocks/comments/1gsav0t/does_everyone_suffer_from_the_same_fomo/
What on earth is happening with ICON PLC?,14,8,https://www.reddit.com/r/stocks/comments/1gskv4q/what_on_earth_is_happening_with_icon_plc/
"/r/Stocks Weekend Discussion Saturday - Nov 16, 2024",9,70,https://www.reddit.com/r/stocks/comments/1gskkw5/rstocks_weekend_discussion_saturday_nov_16_2024/
PENN - Anybody seeing this? Weekly crossed the 50-Day for first time in 3 years...,31,4,https://www.reddit.com/r/stocks/comments/1gsc4ue/penn_anybody_seeing_this_weekly_crossed_the_50day/
Pfizer- am I stuck with take lock or is this a great value? ,55,35,https://www.reddit.com/r/stocks/comments/1gs6lk9/pfizer_am_i_stuck_with_take_lock_or_is_this_a/
Alibaba shares rise 3% in premarket after Chinese tech giant posts 58% jump in profit,258,67,https://www.reddit.com/r/stocks/comments/1gruwrl/alibaba_shares_rise_3_in_premarket_after_chinese/
Why is Buffet buying Domino's DPZ with -$112 book value?,304,192,https://www.reddit.com/r/stocks/comments/1grskde/why_is_buffet_buying_dominos_dpz_with_112_book/
What do you guys think about Dell for earnings(nov 26),32,31,https://www.reddit.com/r/stocks/comments/1gs6xkh/what_do_you_guys_think_about_dell_for_earningsnov/
Thoughts On NVDA Earnings,133,117,https://www.reddit.com/r/stocks/comments/1grrp1y/thoughts_on_nvda_earnings/
MDA Space announces their Q3 earnings,19,14,https://www.reddit.com/r/stocks/comments/1gs1acb/mda_space_announces_their_q3_earnings/
Reddit Favorite ASTS Falls After Q3 Losses Widen,146,51,https://www.reddit.com/r/stocks/comments/1grhvi9/reddit_favorite_asts_falls_after_q3_losses_widen/
Boeing starts issuing layoff notices as planemaker trims 10% of workforce,427,72,https://www.reddit.com/r/stocks/comments/1gr9d5d/boeing_starts_issuing_layoff_notices_as/
Why would you buy shares of a company and buy the same amount in Puts?,154,85,https://www.reddit.com/r/stocks/comments/1grgeyz/why_would_you_buy_shares_of_a_company_and_buy_the/
Is HIMS still Buy after Amazon competition concerns?,123,124,https://www.reddit.com/r/stocks/comments/1grevm3/is_hims_still_buy_after_amazon_competition/
Naive question: Intel 18A--what could go wrong?,9,47,https://www.reddit.com/r/stocks/comments/1grrx4w/naive_question_intel_18awhat_could_go_wrong/
Can someone help me with my evaluation of a stock? ,5,22,https://www.reddit.com/r/stocks/comments/1grwala/can_someone_help_me_with_my_evaluation_of_a_stock/
"Intuitive Machines (LUNR) reports third quarter 2024 results, up 359% YOY, improved profitability with $4.1 million",127,43,https://www.reddit.com/r/stocks/comments/1gr8c91/intuitive_machines_lunr_reports_third_quarter/
Applied Materials Earnings Beat Expectations.,46,12,https://www.reddit.com/r/stocks/comments/1grgefd/applied_materials_earnings_beat_expectations/
Thoughts on Uranium and the Future of Nuclear?,53,64,https://www.reddit.com/r/stocks/comments/1gre29w/thoughts_on_uranium_and_the_future_of_nuclear/
SOXX and Nvidia,15,40,https://www.reddit.com/r/stocks/comments/1grl78h/soxx_and_nvidia/
Deep dive into Cal-Maine - Cracking the shell: The complex World of Eggs,27,6,https://www.reddit.com/r/stocks/comments/1grey27/deep_dive_into_calmaine_cracking_the_shell_the/
Disney narrowly beats estimates as streaming boosts entertainment segment,104,82,https://www.reddit.com/r/stocks/comments/1gr3mpb/disney_narrowly_beats_estimates_as_streaming/
"AMD to lay off 4% of workforce, or about 1,000 employees",714,148,https://www.reddit.com/r/stocks/comments/1gqonzv/amd_to_lay_off_4_of_workforce_or_about_1000/
Where Can We Find Information on Stocks Purchased by Anyone?,4,12,https://www.reddit.com/r/stocks/comments/1grdj5e/where_can_we_find_information_on_stocks_purchased/
"r/Stocks Daily Discussion & Options Trading Thursday - Nov 14, 2024",17,326,https://www.reddit.com/r/stocks/comments/1gr1w6a/rstocks_daily_discussion_options_trading_thursday/
Why do shareholders of a company with positive shareholder equity still receive nothing in the event of bankruptcy?,50,58,https://www.reddit.com/r/stocks/comments/1gqtwgt/why_do_shareholders_of_a_company_with_positive/
Cisco reports fourth straight quarter of declining revenue,95,10,https://www.reddit.com/r/stocks/comments/1gqoqlz/cisco_reports_fourth_straight_quarter_of/
Possible scam? ,0,13,https://www.reddit.com/r/stocks/comments/1gro6lz/possible_scam/
"Robotics, Cyber-Security, Beverage and Industrial Stocks ",65,32,https://www.reddit.com/r/stocks/comments/1gqqlf8/robotics_cybersecurity_beverage_and_industrial/
October CPI rose 2.6% YOY matching the expected 2.6%.  Both CPI and Core CPI are as expected.,225,89,https://www.reddit.com/r/stocks/comments/1gqcy1q/october_cpi_rose_26_yoy_matching_the_expected_26/
SoundHound AI Stock Tumbles as Margins Drop ,44,10,https://www.reddit.com/r/stocks/comments/1gqnswr/soundhound_ai_stock_tumbles_as_margins_drop/
Can someone please brief me up on how I can get into stocks?,0,16,https://www.reddit.com/r/stocks/comments/1groqch/can_someone_please_brief_me_up_on_how_i_can_get/
PG&E to deploy nuclear-specific AI at Diablo Canyon plant ,16,6,https://www.reddit.com/r/stocks/comments/1gqokli/pge_to_deploy_nuclearspecific_ai_at_diablo_canyon/
Nu Holdings (NYSE:NU) is projected to report quarterly earnings at $0.11 per share on revenue of $2.96 billion.,111,61,https://www.reddit.com/r/stocks/comments/1gqab7f/nu_holdings_nysenu_is_projected_to_report/
Need clarification on washsale,3,2,https://www.reddit.com/r/stocks/comments/1gqxej6/need_clarification_on_washsale/
Volkswagen raises Rivian stake by 16% to $5.8 billion,491,74,https://www.reddit.com/r/stocks/comments/1gpwthx/volkswagen_raises_rivian_stake_by_16_to_58_billion/
Supermicro - hold or sell - my strategy,41,64,https://www.reddit.com/r/stocks/comments/1gqa9ht/supermicro_hold_or_sell_my_strategy/
Distribution of your assets between cash/stocks while the market is overvalued?,0,68,https://www.reddit.com/r/stocks/comments/1gqyebb/distribution_of_your_assets_between_cashstocks/
"Rocket Lab Announces Third Quarter 2024 Financial Results, Posts 55% Year-on-Year Growth and Guides to Record Revenue in Q4",343,107,https://www.reddit.com/r/stocks/comments/1gpvw9b/rocket_lab_announces_third_quarter_2024_financial/
Liberty Media to spin off assets; CEO Greg Maffei to step down at year-end,11,3,https://www.reddit.com/r/stocks/comments/1gqe3uf/liberty_media_to_spin_off_assets_ceo_greg_maffei/
"r/Stocks Daily Discussion Wednesday - Nov 13, 2024",19,395,https://www.reddit.com/r/stocks/comments/1gq9xxd/rstocks_daily_discussion_wednesday_nov_13_2024/
"Waymo opens robotaxi service to anyone in Los Angeles, marking its largest expansion yet",517,157,https://www.reddit.com/r/stocks/comments/1gpoc5u/waymo_opens_robotaxi_service_to_anyone_in_los/
Why do some chapter 11s wipe out shareholders while some don’t ? ,23,2,https://www.reddit.com/r/stocks/comments/1gq8v7z/why_do_some_chapter_11s_wipe_out_shareholders/
"Spotify Tops Q3 Forecasts, Reaches 252 Million Premium Subscribers as Revenue Climbs 19%",134,41,https://www.reddit.com/r/stocks/comments/1gpvufy/spotify_tops_q3_forecasts_reaches_252_million/
"Cava beats Revenue and EPS estimates, raises FY Revenue, Profit Margins, and EBITDA guidance, Shares +17%",82,35,https://www.reddit.com/r/stocks/comments/1gpwawh/cava_beats_revenue_and_eps_estimates_raises_fy/
